Project Title,Objective,OutCome,Skills,SuperVisior
Sentiment Analysis of Social Media for Mental Health Awareness,Analyze sentiment from text data Identify mental health indicators Apply NLP techniques Generate meaningful insights,Research paper,Python NLP Machine Learning Data Mining Text Processing,Manpreet Kaur(E12698)
Smart Waste Management System Using IoT,Monitor waste levels automatically Reduce overflow of garbage bins Optimize waste collection process Promote smart city solutions,Product,IoT Basics Sensors Embedded Systems Python Networking,Manpreet Kaur(E12698)
Personal Expense Tracker Using C++,Track personal expenses Improve financial awareness Practice OOP concepts Implement file handling,Product,C++ File Handling OOP Basics Logic Building Data Structures,Manpreet Kaur(E12698)
CodeDiff: An Intuitive Web Platform for Efficient Code Comparison & Versioning,Develop a user-friendly web interface for code comparison with real-time diff visualization syntax highlighting and multi-language support. Integrate version control features for tracking changes and collaboration. Ensure responsive design for accessibility across devices. Promote understanding of code differences enhance debugging efficiency and foster collaborative coding by providing an intuitive platform suitable for developers students and educators.,Product,HTML CSS JavaScript Basic Git Familiarity with Code Editors,Mohit Singh Bisht(E16333)
LearnCode Hub: An Interactive Platform for Coding Tutorials and Quizzes,Create an engaging user-friendly website with interactive tutorials embedded code editors and quizzes. Enable learners to practice coding in real-time receive immediate feedback and track their progress. Incorporate multimedia content to cater to different learning styles and implement gamification elements to motivate users. The goal is to enhance coding literacy boost confidence and provide an accessible platform for self-paced learning.,Product,HTML CSS JavaScript Basic Programming UI/UX Design,Mohit Singh Bisht(E16333)
SnippetShare: A Collaborative Platform for Sharing and Managing Code Snippets,Develop an intuitive collaborative web platform allowing users to share and manage code snippets. Implement user authentication real-time editing commenting and categorization. Enable efficient searching and filtering by tags or keywords. Focus on responsive design security and scalability. The goal is to foster a community where developers can learn from each other improve coding skills and contribute to a shared knowledge base seamlessly.,Product,Full Stack Development HTML CSS JavaScript Backend APIs Database Management,Mohit Singh Bisht(E16333)
Online Multi-language Compiler: An Interactive Web-Based Coding Platform,Create a responsive multi-language online compiler that enables users to write and run code securely. Implement language-specific editors with syntax highlighting code execution via backend APIs and output display areas. Ensure cross-browser compatibility and user-friendly interface. Include features like code saving history and error messages. Aim to facilitate learning testing and quick code execution in a unified web platform.,Product,Full Stack Development Web Technologies JavaScript Backend Integration Data Handling,Mohit Singh Bisht(E16333)
CodeAnalyzer: Static Code Analysis and Feedback Tool,Develop an intuitive platform that accepts code input performs static analysis and delivers actionable feedback. Incorporate syntax highlighting error detection and suggestions for improvements. Ensure secure code handling and support multiple programming languages. Provide a user-friendly interface with clear visual cues and detailed reports. The goal is to enhance code quality promote best practices and serve as an educational aid for learners and professionals.,Product,Full Stack Development Static Code Analysis JavaScript Backend APIs Data Validation,Mohit Singh Bisht(E16333)
Programming Language Quiz Master: An Interactive Coding Language Knowledge Game,Develop a dynamic quiz application that presents language-related questions evaluates answers and displays scores. Implement timers score counters and feedback messages to motivate users. Ensure a responsive interface adaptable to different devices. Include features for question randomization and progress tracking. The goal is to promote learning through gamification making programming language knowledge accessible and enjoyable.,Product,Web Development JavaScript UI Design Data Structures & Algorithms Interactive Content,Mohit Singh Bisht(E16333)
TechConnect: A Collaborative Platform for Students to Share Learn and Code Together,Create an interactive community platform facilitating student collaboration on coding tasks. Include features such as project creation shared code editors discussion forums and leaderboards for challenges. Ensure a responsive user-friendly interface with secure authentication. Integrate code sharing with syntax highlighting and real-time updates. The goal is to promote practical learning teamwork and networking among aspiring developers.,Product,Web Development Collaboration Tools Frontend & Backend User Management Version Control Integrati,Mohit Singh Bisht(E16333)
Stress detection from social media posts using machine learning,Gathering the data cleaning the data Model building and Inference,Research paper,Machine learning and python,Navjot Kaur(E17204)
Anomaly detection system in IoT,Gathering the data cleaning the data Model building and Inference,Research paper,Machine learning and python,Navjot Kaur(E17204)
Online Complaint and Grievance Redressal System using MERN Stack,The main objective of this project is to design a digital grievance management platform that simplifies complaint registration and resolution. It aims to reduce paperwork enhance transparency ensure timely responses and maintain proper records of grievances. The system also enables administrators to analyze complaint trends and improve institutional decision-making processes.,Product,HTML CSS JavaScript React.js Node.js,Aniket Malik(E19687)
College Event Management Portal using MERN Stack,The objective of this project is to build a centralized web-based platform for managing college events efficiently. It aims to automate event creation registration and participant tracking reduce paperwork and improve communication between organizers and students. The system also provides structured event data for future analysis and reporting.,Product,HTML CSS JavaScript React.js Node.js,Aniket Malik(E19687)
Student Performance Tracking Android Application,Record student marks and attendance Analyze academic performance trends Visualize progress using charts Help teachers identify weak areas Support continuous student evaluation,Product,Java/Kotlin Android Studio SQLite/Firebase UI Design Basic Data Analysis,Jasmeet Kaur(E17596)
Smart IoT-Based Energy Monitoring and Optimization System,To monitor real-time energy usage analyze consumption patterns reduce wastage and promote energy-efficient practices through data-driven insights and alerts.,Competition,Embedded C IoT Protocols Sensors & Actuators Arduino/ESP32 Basic Networking,Jaspreet Singh (E1320)
Smart Air Quality Monitoring and Alert System,The objective is to design an intelligent system that continuously monitors air pollution levels and provides timely alerts to users and authorities. The project aims to promote awareness of air quality support preventive measures and encourage data-driven environmental protection using affordable and scalable hardware solutions.,Product,Embedded Systems IoT Sensor Interfacing Data Communication Cloud Basics,Puja Shrivastava(E17060)
Smart Forest Fire Detection System,The objective is to provide early detection of forest fires to reduce large-scale damage to forests and wildlife. The project aims to support forest protection by enabling timely alerts minimizing response time and promoting the use of basic embedded systems for environmental safety.,Product,Microcontrollers Sensor Interfacing Embedded C Circuit Design Troubleshooting,Puja Shrivastava(E17060)
GIS-Based Forest Cover Change Detection System,The objective is to develop a software tool that monitors forest cover changes and identifies deforestation trends. The project aims to support environmental planning protect biodiversity and assist policymakers by providing accurate data-driven insights for sustainable forest conservation.,Product,Python Data Analytics GIS Basics Image Processing Visualization,Puja Shrivastava(E17060)
Futuristic Cloud Data Centers: Intelligent Resource Optimization for Next-Generation Computing,Design an AI-assisted resource optimization framework for heterogeneous cloud data centers. Model and simulate workload-aware scheduling that improves utilization and QoS. Analyze energy and carbon impacts of optimization policies. Map the framework's contributions to relevant SDGs and propose guidelines for sustainable cloud operations.,Research paper,Cloud computing fundamentals (IaaS PaaS SaaS) Basics of virtualization and containers Introducto,Vaneet Kumar(E11321)
AI-Enabled Smart Waste Segregation System,To automate waste segregation reduce human intervention and enhance recycling efficiency using AI-driven decision-making.,Competition,Python Image Processing Embedded Systems Sensors Machine Learning Basics,Jaspreet Singh (E1320)
Health Monitoring Device for Early Detection of Cardiac Anomalies,To design an affordable wearable solution for continuous cardiac monitoring that improves early diagnosis reduces hospital dependency and supports remote healthcare services.,Product,Biomedical Sensors Signal Processing IoT Microcontrollers,Jaspreet Singh (E1320)
Smart Irrigation System Using IoT for Efficient Water Management,To automate irrigation using soil moisture sensing To reduce water wastage To monitor irrigation remotely using IoT,Product,Embedded Systems IoT Arduino Sensors Basic Networking,Amandeep Kaur(E11813)
Intelligent Traffic Signal Control System Using Real-Time Sensor Data,To design an adaptive traffic control system that enhances road efficiency reduces waiting time and minimizes vehicular emissions.,Research paper,Embedded Systems Sensors Control Systems IoT Networking,Jaspreet Singh (E1320)
Quantum-Aware Cloud Data Centers: A New Paradigm for Resource Optimization,Develop hybrid scheduling algorithms for quantum-classical resource optimization. Simulate quantum-aware workload placement and error mitigation strategies. Evaluate energy efficiency and scalability for real-world quantum cloud apps. Propose sustainable integration guidelines for next-gen data centers.,Research paper,Cloud computing fundamentals (IaaS PaaS SaaS) Basics of virtualization and containers Introducto,Vaneet Kumar(E11321)
Cloud-Based Disaster Management and Emergency Response Platform,To enhance disaster preparedness and response efficiency using scalable cloud infrastructure and real-time data analytics.,Hackathon,Cloud Computing Web Development,Jaspreet Singh (E1320)
IoT Based Smart Energy Meter for Real-Time Power Monitoring,To monitor real-time energy consumption To enable remote power monitoring To reduce electricity wastage,Patent,IoT Embedded Systems Sensors Arduino Cloud Basics,Amandeep Kaur(E11813)
Smart Dustbin System for Efficient Waste Management Using IoT,To monitor garbage levels automatically To improve waste collection efficiency To reduce overflow and pollution To support smart city initiatives To maintain cleanliness,Product,Arduino IoT Sensors Embedded Systems Basic Programming,Amandeep Kaur(E11813)
Cloud-Managed Smart Energy Meter for Real-Time Power Analytics,To enable real-time energy monitoring and promote efficient electricity usage through cloud analytics.,Product,IoT Cloud Platforms Data Analytics Networking,Jaspreet Singh (E1320)
AI-Based Resume Screening System Using Machine Learning,To automate resume screening To reduce recruitment time To improve candidate shortlisting accuracy To minimize human bias To support data-driven hiring,Patent,Python Machine Learning NLP Data Analysis SQL,Amandeep Kaur(E11813)
Disease Prediction System Using ML Algorithms,To predict diseases based on symptoms and medical parameters To compare ML models for healthcare prediction accuracy To assist early diagnosis using data-driven techniques To analyze the importance of clinical features,Research paper,Python Machine Learning fundamentals Data handling (Pandas NumPy) Visualization (Matplotlib) Ba,Rajni Devi(E15439)
Automated Smart Waste Segregation System Using Sensors,To automate waste segregation To reduce human involvement in waste handling To improve recycling efficiency To support sustainable waste management,Research paper,Embedded systems programming Sensor interfacing (moisture inductive) Motor and actuator control,Rajni Devi(E15439)
Smart Home Automation System Using IoT,To automate household appliances To enable remote monitoring and control To improve energy efficiency To enhance user comfort and safety,Research paper,Embedded C / Arduino programming Relay and load control IoT platforms and mobile apps Basic elect,Rajni Devi(E15439)
Quantum-Inspired Optimization Algorithms for Efficient Cloud Resource Management,Implement quantum-inspired metaheuristics for multi-objective cloud optimization. Simulate workload distribution and resource provisioning on cloud platforms. Compare performance against classical methods in utilization latency and energy.,Research paper,Python Machine learning,Vaneet Kumar(E11321)
IoT-Enabled Audio-Based Attendance System Using Speaker Recognition,To capture voice samples using a microphone To identify individuals using speaker recognition To automatically mark attendance in a cloud database To provide real-time monitoring via a web/mobile interface,Product,Python IoT,Vaneet Kumar(E11321)
Climate Change Impact Assessment on Agricultural Productivity Using Machine Learning Techniques,To analyze historical climate data and agricultural yield patterns To study the impact of temperature rainfall and humidity on crop productivity To develop machine learning models for crop yield prediction under climate variability To identify key climatic factors influencing agricultural output To support climate-resilient agricultural planning,Research paper,Python programming Machine Learning fundamentals Data preprocessing and analysis Statistics and r,Rajni Devi(E15439)
Smart Automatic Street Light System,To reduce energy consumption by automatically controlling street lights based on ambient light and motion detection. To eliminate manual operation of street lights ensuring efficient and reliable functioning. To improve public safety by providing adequate lighting only when vehicles or pedestrians are present. To increase the lifespan of street lights by minimizing unnecessary ON time. To support smart city development through intelligent and automated infrastructure. To reduce operational,Product,sensors,Parul Datta(E17144)
IoT-Based Smart bin,To monitor garbage levels in real time using sensors and IoT technology. To prevent overflow of dustbins by sending timely alerts for waste collection. To improve waste collection efficiency by optimizing collection schedules and routes. To reduce manual monitoring of dustbins saving time and labor. To promote cleanliness and hygiene in public places. To support smart city and digital infrastructure initiatives. To enable data-driven waste management through cloud-based monitoring.,Product,iot,Parul Datta(E17144)
Automatic Plant Watering System,To automate the irrigation process based on real-time soil moisture levels. To conserve water by preventing overwatering and unnecessary water usage. To reduce manual effort required for plant watering. To ensure healthy plant growth by maintaining optimal soil moisture. To improve irrigation efficiency using sensor-based control.,Product,sensors,Parul Datta(E17144)
RFID-Based Attendance Marking System,To automate the attendance process using RFID technology. To reduce manual effort and paperwork involved in attendance management. To improve accuracy and reliability of attendance records. To prevent proxy attendance and unauthorized access. To save time during attendance collection.,Product,sensors,Parul Datta(E17144)
Temperature and Humidity Monitoring System,To measure temperature and humidity accurately using environmental sensors. To monitor environmental conditions in real time. To display measured values clearly for easy observation. To generate alerts when temperature or humidity exceeds set limits. To reduce manual monitoring of environmental conditions.,Product,sensors,Parul Datta(E17144)
Online puzzle Quiz Application,To provide an automated platform for conducting quizzes online. To eliminate manual evaluation and reduce human errors. To save time and resources involved in traditional quiz methods. To enable instant result generation and feedback. To support remote assessments and online learning.,Research paper,python,Parul Datta(E17144)
Expense Tracker Application,To provide a simple and efficient platform for tracking daily expenses. To help users manage personal finances effectively. To categorize expenses for better analysis and understanding. To generate expense summaries and reports automatically. To support budgeting and financial planning.,Research paper,python,Parul Datta(E17144)
Multimodel attention transformer for IIOT intrusion detection,objective to ensure real world feasibility by optimizing the model with less inference time and enabling efficient deployement,Research paper,python,Ankita Dhiman(E11431)
Smart Attendance System Using Face Recognition,To automate classroom attendance. To reduce proxy attendance. To understand basic image processing concepts.,Research paper,OpenCV and Python,Amit Kumar(E13989)
IoT-Based Smart Irrigation System,To optimize water usage in agriculture. To learn sensor-based automation. To understand IoT communication.,Research paper,Python and R programming,Amit Kumar(E13989)
Online Examination System with Automatic Evaluation,To develop a web-based examination platform. To automate result generation. To learn basic web technologies.,Research paper,HTML CSS JavaScript and PHP.,Amit Kumar(E13989)
Early Detection of Alzheimer's Disease Using Multi-Modal Deep Learning with Explainable AI,To analyze MRI and clinical data for Alzheimer's diagnosis To design a multi-modal deep learning model for early detection To improve diagnostic accuracy compared to single-modal approaches To apply Explainable AI techniques for transparent decision making To support clinicians with interpretable AI-based predictions,Research paper,Python Machine Learning Deep Learning Medical Imaging Data Analysis,Narinder Kaur(E12264)
Weather Forecasting Using Machine Learning,To analyze historical weather data. To apply basic machine learning algorithms. To predict temperature or rainfall.,Research paper,DL and ML,Amit Kumar(E13989)
Chatbot for College Enquiry System,To automate student enquiry handling. To understand Natural Language Processing basics. To improve user interaction.,Research paper,Python,Amit Kumar(E13989)
Road Accident Analysis Using Data Analytics,To analyze accident data. To identify accident-prone areas. To visualize statistical trends.,Research paper,Python,Amit Kumar(E13989)
Password Strength Checker Using Python,To evaluate password security. To understand cybersecurity basics. To promote safe password practices.,Research paper,Python,Amit Kumar(E13989)
"Implementation of Anomaly-Based Intrusion Detection System Using Machine Learning",This project aims to design an anomaly-based Intrusion Detection System using machine learning techniques to detect suspicious network activities. The system learns normal network behavior from traffic data and identifies deviations as potential intrusions. Algorithms such as Isolation Forest SVM or Random Forest are applied to improve detection accuracy and reduce false positives enhancing network security.,Research paper,Python Machine Learning Networking Basics Cyber Security Data Preprocessing,Narinder Kaur(E12264)
Student Performance Prediction System using python,To predict student academic performance. To apply basic data mining techniques. To support early intervention.,Research paper,Python,Amit Kumar(E13989)
Smart Waste Management System Using IoT and python,To monitor waste levels in bins. To improve waste collection efficiency. To learn IoT sensor integration.,Research paper,Python,Amit Kumar(E13989)
Weather Prediction Using Machine Learning Techniques,To study basic weather parameters and datasets To collect and preprocess historical weather data To implement machine learning models for prediction To compare model performance using accuracy metrics To develop a simple weather prediction system,Product,Python Machine Learning Basics Data Analysis Statistics Visualization,Narinder Kaur(E12264)
Early Detection of Wheat Diseases,Development of Al/ML-based image recognition tools integrated with drone/satellite data and mobile apps to provide real-time detection mapping and alerts to farmers.,Patent,Machine learning and python,Navjot Kaur(E17204)
Recovery and reuse of Fresh water resources,This problem statement proposes the design of a Smart Process System design for separation and cleaning at primary (solid removal) secondary (organic removal) and tertiary (nutrient and advanced contaminant removal) treatment stages with the level of treatment determined by the intended reuse.,Patent,Machine learning and python,Navjot Kaur(E17204)
Water Quality Prediction,"1. To design and implement a predictive model that accurately estimates water quality or potability using measured water parameters. 2. To build a prototype software or web application that allows users to input water quality readings and receive an automatic prediction of water safety.",Research paper,Machine learning and python,Navjot Kaur(E17204)
Automatic Street Light System,The objective of the Smart Automatic Street Light System is to design and implement an energy-efficient lighting solution that automatically controls street lights based on ambient light intensity. The system aims to reduce power consumption by switching lights ON only during darkness and OFF during daylight. It eliminates manual operation minimizes human error supports sustainable energy usage and provides a cost-effective and reliable solution suitable for smart city and public lighting app,Product,Arduino Basics,Neha (E10457)
Smart Attendance System Using Face Recognition with Bias Analysis,Build a face-recognition-based attendance system and analyze bias across lighting conditions pose and gender.,Research paper,ML,Kiranjeet Kaur Sandhu(E12258)
Fake News Detection Using Classical ML and NLP Techniques,Detect fake news using TF-IDF + ML models and analyze which features matter most.,Research paper,Naive Bayes SVM Random Forest,Kiranjeet Kaur Sandhu(E12258)
Smart Traffic Density Prediction Using Image Processing,Estimate traffic density using background subtraction and object counting,Research paper,Open CV,Kiranjeet Kaur Sandhu(E12258)
IoT-based smart medicine reminder box,"1.To generate multi-mode reminders (light sound and/or text notifications) at scheduled times so that patients are alerted whenever a dose is due. 2. To detect and log each box opening (or pill retrieval) as a proxy for dose intake and store this data on a backend or cloud database for later analysis.",Patent,Basic C programming for Arduino Circuit design and sensor interfacing,Navjot Kaur(E17204)
Phishing Website Detection Using Machine Learning,Detect phishing websites by analyzing URL-based and domain features using classical ML models.,Research paper,Logistic Regression Random Forest SVM,Kiranjeet Kaur Sandhu(E12258)
Smart Energy Consumption Prediction Using Machine Learning,Predict household energy consumption using historical usage data.,Research paper,Linear Regression Random Forest,Kiranjeet Kaur Sandhu(E12258)
Password Manager Application,Securely store user credentials Implement encryption techniques Generate strong passwords Build a user-friendly interface Improve password security awareness,Product,C++/Qt or Python Encryption basics File handling UI design,Neha (E10457)
Online Discussion Forum Website,Enable user-generated content Implement CRUD operations Design a responsive UI Manage posts efficiently Encourage online discussions,Product,Node.js Express MongoDB HTML CSS JavaScript,Neha (E10457)
Smart Online Voting System,Provide secure online voting Authenticate voters effectively Prevent multiple voting attempts Display election results transparently Reduce manual voting effort,Product,HTML CSS JavaScript Node.js Express MongoDB,Neha (E10457)
Real-Time Chat Application,Enable real-time communication Implement user authentication Store chat history securely Show online/offline status Improve user interaction,Product,HTML CSS JavaScript Node.js Socket.IO MongoDB,Neha (E10457)
Online Learning Management System (LMS),Manage courses and users Enable student enrollment Track learning progress Provide role-based access Improve digital learning experience,Product,HTML CSS JavaScript Node.js Express Database basics,Neha (E10457)
Job Portal Web Application,Simplify job search process Enable job postings and applications Manage user profiles Improve recruitment efficiency Organize job listings effectively,Product,HTML CSS JavaScript Node.js Express MongoDB,Neha (E10457)
Event Management and Booking System,Display upcoming events Enable online ticket booking Manage event details Generate booking confirmations Reduce manual event handling,Product,HTML CSS JavaScript Node.js Express Payment Gateway basics,Neha (E10457)
Blockchain-Enabled IoT Data Integrity System,To ensure secure and tamper-proof IoT sensor data storage,Research paper,smart contracts IoT gateways,Kiranjeet Kaur Sandhu(E12258)
